{
  "schemaVersion": "1.0.0",
  "baseline": {
    "id": "baseline-v2.6.1-v0.5.1",
    "source": {
      "repository": "Azure/bicep-ptn-aiml-landing-zone",
      "releaseTag": "v2.6.1",
      "commitSha": "64195c01b70974fa7256c2f54a0035fb06804139"
    },
    "terraform": {
      "repository": "Azure/terraform-azurerm-avm-ptn-aiml-landing-zone",
      "releaseTag": "v0.5.1",
      "commitSha": "abe337894f93de3ddda525ea44898b33e1484070"
    },
    "assessedAt": "2026-08-21T18:39:46Z",
    "status": "active"
  },
  "scenarios": [
    "standalone-standard",
    "standalone-network-isolated"
  ],
  "surfaceContracts": {
    "inputs": [],
    "outputs": [],
    "runtimeKeys": []
  },
  "capabilities": []
}
