{
  "schemaVersion": "1.0.0",
  "baseline": {
    "id": "baseline-v2.6.1-v0.5.1",
    "source": {
      "repository": "Azure/bicep-ptn-aiml-landing-zone",
      "releaseTag": "v2.6.1",
      "commitSha": "64195c01b70974fa7256c2f54a0035fb06804139"
    },
    "terraform": {
      "repository": "Azure/terraform-azurerm-avm-ptn-aiml-landing-zone",
      "releaseTag": "v0.5.1",
      "commitSha": "abe337894f93de3ddda525ea44898b33e1484070"
    },
    "assessedAt": "2026-08-21T18:39:46Z",
    "status": "active"
  },
  "scenarios": [
    "standalone-standard",
    "standalone-network-isolated"
  ],
  "surfaceContracts": {
    "inputs": [
      {
        "name": "sample",
        "kind": "input",
        "type": {
          "representation": "built-in",
          "name": "string"
        },
        "required": false,
        "default": {
          "representation": "literal",
          "value": "sample-default"
        },
        "allowedValues": ["sample-default", "alternate"]
      },
      {
        "name": "expressionSample",
        "kind": "input",
        "type": {
          "representation": "built-in",
          "name": "string"
        },
        "required": false,
        "default": {
          "representation": "expression",
          "expression": "[resourceGroup().location]"
        },
        "allowedValues": []
      }
    ],
    "outputs": [
      {
        "name": "SAMPLE_OUTPUT",
        "kind": "output",
        "type": {
          "representation": "built-in",
          "name": "string"
        }
      }
    ],
    "runtimeKeys": [
      {
        "name": "<APP>_NAME",
        "kind": "runtime-key",
        "classification": "pattern",
        "pattern": "^[A-Z][A-Z0-9_]*_NAME$"
      }
    ]
  },
  "capabilities": [
    {
      "id": "sample-capability",
      "category": "testing",
      "title": "Sanitized sample capability",
      "description": "Exercises deterministic parity validation without Azure access.",
      "referenceEvidence": ["main.bicep:sample"],
      "terraformEvidence": ["main.tf:sample"],
      "consumerSurfaces": ["input:expressionSample", "input:sample", "output:SAMPLE_OUTPUT", "runtime-key:<APP>_NAME"],
      "identityRbacAssertions": [],
      "networkAssertions": [],
      "scenarioAssessments": [
        {
          "scenario": "standalone-standard",
          "supportStatus": "full",
          "evidenceLevel": "static",
          "parityDeclared": false,
          "consumerImpact": "",
          "compatibility": {
            "expectation": "preserve",
            "affectedInputs": [],
            "affectedOutputs": [],
            "defaultDifferences": [],
            "migrationRequired": false
          },
          "proposalIds": [],
          "evidenceIds": []
        },
        {
          "scenario": "standalone-network-isolated",
          "supportStatus": "partial",
          "evidenceLevel": "static",
          "parityDeclared": false,
          "consumerImpact": "The fixture intentionally records incomplete static support.",
          "compatibility": {
            "expectation": "preserve",
            "affectedInputs": [],
            "affectedOutputs": [],
            "defaultDifferences": [],
            "migrationRequired": false
          },
          "proposalIds": [],
          "evidenceIds": []
        }
      ],
      "owner": "AI Landing Zone maintainers"
    }
  ]
}
